{
  "title": "ServiceStatusResult",
  "$schema": "https://json-schema.org/draft/2020-12/schema",
  "type": "object",
  "properties": {
    "state": {
      "type": "string",
      "enum": [
        "not_installed",
        "installed_not_running",
        "running"
      ]
    },
    "supervisor": {
      "type": "string",
      "enum": [
        "launchd",
        "systemd"
      ]
    },
    "label": {
      "type": "string",
      "minLength": 1
    },
    "unitPath": {
      "type": "string",
      "minLength": 1
    },
    "unitInstalled": {
      "type": "boolean"
    },
    "binPath": {
      "type": "string",
      "minLength": 1
    },
    "registered": {
      "type": "boolean"
    },
    "pid": {
      "type": "integer",
      "exclusiveMinimum": 0,
      "maximum": 9007199254740991
    },
    "home": {
      "type": "string",
      "minLength": 1
    },
    "socketPath": {
      "type": "string",
      "minLength": 1
    }
  },
  "required": [
    "state",
    "supervisor",
    "label",
    "unitPath",
    "unitInstalled",
    "binPath",
    "registered",
    "home",
    "socketPath"
  ],
  "additionalProperties": false
}
